Author full names	Title	Link	Affiliations	Authors with affiliations
"Iqbal, Muhammad Waseem (57194948912); Shahzad, Syed Khuram (35732008400); Aslam, Muhammad Waseem (58705143800); Rana, Toqir A. (57188758524); Arif, Muhammad (56452459100)"	Addressing Gestures for One-Handed Mobile Interaction Techniques	https://www.scopus.com/inward/record.uri?eid=2-s2.0-85177530195&doi=10.1201%2f9781003190301-11&partnerID=40&md5=c33ba9403ec6f826be16acd3457d7ab6	"Superior University, Lahore, Pakistan; University of Management and Technology, Lahore, Pakistan"	"Iqbal M.W., Superior University, Lahore, Pakistan; Shahzad S.K., University of Management and Technology, Lahore, Pakistan; Aslam M.W., Superior University, Lahore, Pakistan; Rana T.A., Superior University, Lahore, Pakistan; Arif M., Superior University, Lahore, Pakistan"
"Hamid, Khalid (57702518800); Iqbal, Muhammad Waseem (57194948912); Ashraf, Muhammad Usman (57203054223); Alghamdi, Ahmed Mohammed (57195754580); Bahaddad, Adel A. (56922260800); Almarhabi, Khalid Ali (57204803888)"	Optimized Evaluation of Mobile Base Station by Modern Topological Invariants	https://www.scopus.com/inward/record.uri?eid=2-s2.0-85139049620&doi=10.32604%2fcmc.2023.032271&partnerID=40&md5=6103a66251011f3dc6b839189cfdb22a	"Department of Computer Science, Superior University, Lahore, 54000, Pakistan; Department of Software Engineering, Superior University, Lahore, 54000, Pakistan; Department of Computer Science, GC Women University, Sialkot, 53310, Pakistan; Department of Software Engineering, College of Computer Science and Engineering, University of Jeddah, 21493, Saudi Arabia; Department of Information System, Faculty of Computing and Information Technology, King Abdulaziz University, Jeddah, 21589, Saudi Arabia; Department of Computer Science, College of Computing in Al-Qunfudah, Umm Al-Qura University, Makkah, 24381, Saudi Arabia"	"Hamid K., Department of Computer Science, Superior University, Lahore, 54000, Pakistan; Iqbal M.W., Department of Software Engineering, Superior University, Lahore, 54000, Pakistan; Ashraf M.U., Department of Computer Science, GC Women University, Sialkot, 53310, Pakistan; Alghamdi A.M., Department of Software Engineering, College of Computer Science and Engineering, University of Jeddah, 21493, Saudi Arabia; Bahaddad A.A., Department of Information System, Faculty of Computing and Information Technology, King Abdulaziz University, Jeddah, 21589, Saudi Arabia; Almarhabi K.A., Department of Computer Science, College of Computing in Al-Qunfudah, Umm Al-Qura University, Makkah, 24381, Saudi Arabia"
"Mohsin, Muhammad (58253973800)"	High-performance work systems and future time perspective mediation through two lenses courage and well-being: testing a serial mediation mechanism	https://www.scopus.com/inward/record.uri?eid=2-s2.0-85149027113&doi=10.1108%2fK-04-2022-0621&partnerID=40&md5=cc5daa2be7d80b04244edba9fb23c598	"Faculty of Business and Management Sciences, Superior University, Lahore, Pakistan"	"Mohsin M., Faculty of Business and Management Sciences, Superior University, Lahore, Pakistan"
"Hussain, Azhar (58276970400); Nisar, Qasim Ali (57196414030); Khan, Waqas (57214226927); Niazi, Umair Imran (58080605000); Malik, Maida (58250249600)"	When and how big data analytics and work practices impact on financial performance: an intellectual capital perspective from banking industry	https://www.scopus.com/inward/record.uri?eid=2-s2.0-85159334365&doi=10.1108%2fK-11-2022-1623&partnerID=40&md5=13fbf1b880ac24694ca13a0ba786bb1e	"Department of Business and Management Sciences, Superior University, Lahore, Pakistan; Department of Finance, Government College University Lahore, Lahore, Pakistan; Business School, National University of Sciences and Technology, Islamabad, Pakistan"	"Hussain A., Department of Business and Management Sciences, Superior University, Lahore, Pakistan; Nisar Q.A., Department of Business and Management Sciences, Superior University, Lahore, Pakistan; Khan W., Department of Finance, Government College University Lahore, Lahore, Pakistan; Niazi U.I., Department of Business and Management Sciences, Superior University, Lahore, Pakistan; Malik M., Business School, National University of Sciences and Technology, Islamabad, Pakistan"
"Khan, Hamayun (57208213683); Din, Irfan Ud (55804793300); Ali, Arshad (57204889396); Alshmrany, Sami (57216829555)"	Energy-Efficient Scheduling Based on Task Migration Policy Using DPM for Homogeneous MPSoCs	https://www.scopus.com/inward/record.uri?eid=2-s2.0-85139065885&doi=10.32604%2fcmc.2023.031223&partnerID=40&md5=55fff0eba9134296c0bc77dbbe5fc918	"Department of Electrical Engineering, Faculty of Engineering & Technology Superior University, Lahore, 54000, Pakistan; Department of Computer Science, Faculty of Computer Science &, IT Superior University, Lahore, 54000, Pakistan; Faculty of Computer and Information Systems, Islamic University of Madinah, Al Madinah Al Munawarah, 42351, Saudi Arabia"	"Khan H., Department of Electrical Engineering, Faculty of Engineering & Technology Superior University, Lahore, 54000, Pakistan; Din I.U., Department of Computer Science, Faculty of Computer Science &, IT Superior University, Lahore, 54000, Pakistan; Ali A., Faculty of Computer and Information Systems, Islamic University of Madinah, Al Madinah Al Munawarah, 42351, Saudi Arabia; Alshmrany S., Faculty of Computer and Information Systems, Islamic University of Madinah, Al Madinah Al Munawarah, 42351, Saudi Arabia"
"Ahmad, Bilal (57211588325); Bilal, Saba (57482243100)"	Does fear of COVID-19 undermine career optimism? A time-lagged quantitative inquiry of non-managerial employees	https://www.scopus.com/inward/record.uri?eid=2-s2.0-85126049100&doi=10.1108%2fK-10-2021-1036&partnerID=40&md5=d981e5eb39a6086b5eddfab72a717a52	"Superior University, Lahore, Pakistan; University of the Punjab, Lahore, Pakistan"	"Ahmad B., Superior University, Lahore, Pakistan; Bilal S., University of the Punjab, Lahore, Pakistan"
"Shahzad, H.M. (58062317400); Bhatti, Sohail Masood (56730176600); Jaffar, Arfan (26654126000); Rashid, Muhammad (57221707362); Akram, Sheeraz (56199595000)"	Multi-Modal CNN Features Fusion for Emotion Recognition: A Modified Xception Model	https://www.scopus.com/inward/record.uri?eid=2-s2.0-85169680887&doi=10.1109%2fACCESS.2023.3310428&partnerID=40&md5=b88b0af69c62aa4f2518c20b6b24d431	"Superior University, Faculty of Computer Science and Information Technology, Lahore, 55150, Pakistan; Intelligent Data Visual Computing Research (IDVCR), Lahore, 55150, Pakistan; National University of Technology, Department of Computer Science, Islamabad, 45000, Pakistan; Imam Mohammad Ibn Saud Islamic University (IMSIU), College of Computer and Information Sciences, Information Systems Department, Riyadh, 12571, Saudi Arabia"	"Shahzad H.M., Superior University, Faculty of Computer Science and Information Technology, Lahore, 55150, Pakistan, Intelligent Data Visual Computing Research (IDVCR), Lahore, 55150, Pakistan; Bhatti S.M., Superior University, Faculty of Computer Science and Information Technology, Lahore, 55150, Pakistan, Intelligent Data Visual Computing Research (IDVCR), Lahore, 55150, Pakistan; Jaffar A., Superior University, Faculty of Computer Science and Information Technology, Lahore, 55150, Pakistan, National University of Technology, Department of Computer Science, Islamabad, 45000, Pakistan; Rashid M., National University of Technology, Department of Computer Science, Islamabad, 45000, Pakistan; Akram S., Superior University, Faculty of Computer Science and Information Technology, Lahore, 55150, Pakistan, Intelligent Data Visual Computing Research (IDVCR), Lahore, 55150, Pakistan, Imam Mohammad Ibn Saud Islamic University (IMSIU), College of Computer and Information Sciences, Information Systems Department, Riyadh, 12571, Saudi Arabia"
"Ma, Liangze (58047081300); Umair Ashraf, Rana (57200152226); Ahtisham ul Haq, Muhammad (58046430400); Fan, Xianhua (58046761900)"	Hurdles on the Way to Sustainable Development in the Education Sector of China	https://www.scopus.com/inward/record.uri?eid=2-s2.0-85145924179&doi=10.3390%2fsu15010217&partnerID=40&md5=7787e33e194bb2f268d798347209f558	"Faculty of International Tourism and Management, Universidade da Cidade de Macau, 999078, Macao; Department of Management and Information Technology, Faculty of Economic Sciences, University of Warsaw, Warsaw, 00-927, Poland; Faculty of Business Administration, The Superior University, Lahore, 54000, Pakistan; School of Economics and Management, China University of Geosciences, Wuhan, 430074, China"	"Ma L., Faculty of International Tourism and Management, Universidade da Cidade de Macau, 999078, Macao; Umair Ashraf R., Department of Management and Information Technology, Faculty of Economic Sciences, University of Warsaw, Warsaw, 00-927, Poland; Ahtisham ul Haq M., Faculty of Business Administration, The Superior University, Lahore, 54000, Pakistan; Fan X., School of Economics and Management, China University of Geosciences, Wuhan, 430074, China"
"Shakir, Mustafa (23390603300); Ahmad, Saeed (57701282300); Hannan, Sundas (57203093469); Ahmad, Bilal (57540598500); Aslam, Sohaib (57213892940); Rizwan, Muhammad (57217705073)"	Implementation of SVPWM based Multilevel Three Phase Inverter to Reduce THD	https://www.scopus.com/inward/record.uri?eid=2-s2.0-85152056909&doi=10.1109%2fIMCERT57083.2023.10075245&partnerID=40&md5=cbf2c64ef05c1777eb78d3d7b32f9147	"Superior University, Department of Electrical Engineering, Lahore, Pakistan; Department of Electrical and Power Generation Masood Textile Mills, Faisalabad, Pakistan; Department of Research and Development Smart Sunrays, Lahore, Pakistan; Crust Engineering, Lahore, Pakistan"	"Shakir M., Superior University, Department of Electrical Engineering, Lahore, Pakistan; Ahmad S., Department of Electrical and Power Generation Masood Textile Mills, Faisalabad, Pakistan; Hannan S., Department of Research and Development Smart Sunrays, Lahore, Pakistan; Ahmad B., Crust Engineering, Lahore, Pakistan; Aslam S., Superior University, Department of Electrical Engineering, Lahore, Pakistan; Rizwan M., Superior University, Department of Electrical Engineering, Lahore, Pakistan"
"Li, Meilian (57235396200); Asif, Muhammad (58226085900); Ali, Haidar (58633356600); Mahmood, Fizza (58590561000); Ali, Parvez (56158513100)"	Kirchhoff Index and Additive Kirchhoff Index Based on Multiplicative Degree for a Random Polyomino Chain	https://www.scopus.com/inward/record.uri?eid=2-s2.0-85152657246&doi=10.3390%2fsym15030718&partnerID=40&md5=2512c26616112b138336b1a5d4000055	"School of Mathematics and Information Engineering, Longyan University, Longyan, 364012, China; School of Mathematical Sciences, Xiamen University, Xiamen, 361005, China; Faculty of Sciences, The Superior University, Lahore, 54000, Pakistan; Department of Mathematics, Riphah International University, Faisalabad, 38000, Pakistan; Department of Mathematics, Government College Women University, Faisalabad, 38000, Pakistan; Department of Mechanical Engineering, College of Engineering, Qassim University, Unaizah, 56215, Saudi Arabia"	"Li M., School of Mathematics and Information Engineering, Longyan University, Longyan, 364012, China; Asif M., School of Mathematical Sciences, Xiamen University, Xiamen, 361005, China, Faculty of Sciences, The Superior University, Lahore, 54000, Pakistan; Ali H., Department of Mathematics, Riphah International University, Faisalabad, 38000, Pakistan; Mahmood F., Department of Mathematics, Government College Women University, Faisalabad, 38000, Pakistan; Ali P., Department of Mechanical Engineering, College of Engineering, Qassim University, Unaizah, 56215, Saudi Arabia"
"Manzoor, Saher (57217199762); Ashraf, Muhammad Waseem (7201371732); Tayyaba, Shahzadi (35811319900); Tariq, Muhammad Imran (57189302948); Hossain, M. Khalid (57194104114)"	"Recent Progress of Fabrication, Characterization, and Applications of Anodic Aluminum Oxide (AAO) Membrane: A Review"	https://www.scopus.com/inward/record.uri?eid=2-s2.0-85139871265&doi=10.32604%2fcmes.2022.022093&partnerID=40&md5=0126786c07c3acaecaf385b0358ba17e	"Department of Physics (Electronics), GC University, Lahore, 54000, Pakistan; Department of Computer Engineering, The University of Lahore, Lahore, 54000, Pakistan; Department of Computer Science, Superior University, Lahore, 54000, Pakistan; Atomic Energy Research Establishment, Bangladesh Atomic Energy Commission, Dhaka, 1349, Bangladesh"	"Manzoor S., Department of Physics (Electronics), GC University, Lahore, 54000, Pakistan; Ashraf M.W., Department of Physics (Electronics), GC University, Lahore, 54000, Pakistan; Tayyaba S., Department of Computer Engineering, The University of Lahore, Lahore, 54000, Pakistan; Tariq M.I., Department of Computer Science, Superior University, Lahore, 54000, Pakistan; Hossain M.K., Atomic Energy Research Establishment, Bangladesh Atomic Energy Commission, Dhaka, 1349, Bangladesh"
"Nasim, Fawad (57324445500); Masood, Sohail (58157113700); Jaffar, Arfan (26654126000); Ahmad, Usman (57204023672); Rashid, Muhammad (57221707362)"	Intelligent Sound-Based Early Fault Detection System for Vehicles	https://www.scopus.com/inward/record.uri?eid=2-s2.0-85158880584&doi=10.32604%2fcsse.2023.034550&partnerID=40&md5=724c8eafa3844dd7cb0ddfde0c244156	"Superior University, Lahore, Pakistan; Intelligent Data Visual Computing Research (IDVCR), Lahore, Pakistan; National University of Technology, Islamabad, Pakistan"	"Nasim F., Superior University, Lahore, Pakistan, Intelligent Data Visual Computing Research (IDVCR), Lahore, Pakistan; Masood S., Superior University, Lahore, Pakistan, Intelligent Data Visual Computing Research (IDVCR), Lahore, Pakistan; Jaffar A., Superior University, Lahore, Pakistan, Intelligent Data Visual Computing Research (IDVCR), Lahore, Pakistan; Ahmad U., Superior University, Lahore, Pakistan; Rashid M., National University of Technology, Islamabad, Pakistan"
"Tariq, Asadullah (57215870294); Salabi, Farag (58183716100); Serhani, Mohamed Adel (15925757100); Din, Irfan Ud (55804793300)"	NSoV: An Efficient SDVC Assisted Forwarding Model in NDN Based IoV	https://www.scopus.com/inward/record.uri?eid=2-s2.0-85152580297&doi=10.1007%2f978-3-031-28387-1_46&partnerID=40&md5=7c0d211933c717a8367e562cd324aef2	"College of Information Technology, United Arab Emirates University, Al Ain, United Arab Emirates; The Superior University, Lahore, 54000, Pakistan"	"Tariq A., College of Information Technology, United Arab Emirates University, Al Ain, United Arab Emirates; Salabi F., College of Information Technology, United Arab Emirates University, Al Ain, United Arab Emirates; Serhani M.A., College of Information Technology, United Arab Emirates University, Al Ain, United Arab Emirates; Din I.U., The Superior University, Lahore, 54000, Pakistan"
"Usman, Muhammad (57222760537); Ijaz Malik, Muhammad Ali (57217679790); Chaudhary, Tariq Nawaz (57207296160); Riaz, Fahid (56610065900); Raza, Sohaib (58176092200); Abubakar, Muhammad (58249996700); Ahmad Malik, Farrukh (58249290100); Muhammad Ahmad, Hafiz (58249521700); Fouad, Yasser (6603123645); Abbas, Muhammad Mujtaba (57218272046); Kalam, Muhammad Abul (55103352400)"	Comparative Assessment of Ethanol and Methanol–Ethanol Blends with Gasoline in SI Engine for Sustainable Development	https://www.scopus.com/inward/record.uri?eid=2-s2.0-85159270251&doi=10.3390%2fsu15097601&partnerID=40&md5=acb0a998278f58670ff90b654a8ee630	"Department of Mechanical Engineering, University of Engineering and Technology, Lahore, 54890, Pakistan; Department of Mechanical Engineering, Superior University, Raiwind Road, Lahore, 54000, Pakistan; Mechanical Engineering Department, Abu Dhabi University, P.O. Box 59911, Abu Dhabi, United Arab Emirates; Department of Applied Mechanical Engineering, College of Applied Engineering, Muzahimiyah Branch, King Saud University, P.O. Box 800, Riyadh, 11421, Saudi Arabia; Department of Mechanical Engineering, University of Engineering and Technology (New Campus), Lahore, 54890, Pakistan; School of Civil and Environmental Engineering, FEIT, University of Technology Sydney, Ultimo, 2007, NSW, Australia"	"Usman M., Department of Mechanical Engineering, University of Engineering and Technology, Lahore, 54890, Pakistan; Ijaz Malik M.A., Department of Mechanical Engineering, Superior University, Raiwind Road, Lahore, 54000, Pakistan; Chaudhary T.N., Department of Mechanical Engineering, University of Engineering and Technology, Lahore, 54890, Pakistan; Riaz F., Mechanical Engineering Department, Abu Dhabi University, P.O. Box 59911, Abu Dhabi, United Arab Emirates; Raza S., Department of Mechanical Engineering, University of Engineering and Technology, Lahore, 54890, Pakistan; Abubakar M., Department of Mechanical Engineering, University of Engineering and Technology, Lahore, 54890, Pakistan; Ahmad Malik F., Department of Mechanical Engineering, University of Engineering and Technology, Lahore, 54890, Pakistan; Muhammad Ahmad H., Department of Mechanical Engineering, University of Engineering and Technology, Lahore, 54890, Pakistan; Fouad Y., Department of Applied Mechanical Engineering, College of Applied Engineering, Muzahimiyah Branch, King Saud University, P.O. Box 800, Riyadh, 11421, Saudi Arabia; Abbas M.M., Department of Mechanical Engineering, University of Engineering and Technology (New Campus), Lahore, 54890, Pakistan; Kalam M.A., School of Civil and Environmental Engineering, FEIT, University of Technology Sydney, Ultimo, 2007, NSW, Australia"
"Akram, Muhammad (56344642100); Iqbal, Muhammad Waseem (57194948912); Ashraf, M. Usman (57203054223); Arif, Erssa (57351930700); Alsubhi, Khalid (24823878100); Aljahdali, Hani Moaiteq (57192160630)"	Optimization of Interactive Videos Empowered the Experience of Learning Management System	https://www.scopus.com/inward/record.uri?eid=2-s2.0-85147326316&doi=10.32604%2fcsse.2023.034085&partnerID=40&md5=37dba5b574d865604575872198b63a65	"Department of Computer Science, Superior University Lahore, Lahore, 54000, Pakistan; Department of Software Engineering, Superior University Lahore, Lahore, 54000, Pakistan; Department of Computer Science, GC Women University, Sialkot, Pakistan; Department of Computer Science, King Abdulaziz University, Jeddah, Saudi Arabia; Faculty of Computing and Information Technology, King Abdulaziz University, Jeddah, Saudi Arabia"	"Akram M., Department of Computer Science, Superior University Lahore, Lahore, 54000, Pakistan; Iqbal M.W., Department of Software Engineering, Superior University Lahore, Lahore, 54000, Pakistan; Ashraf M.U., Department of Computer Science, GC Women University, Sialkot, Pakistan; Arif E., Department of Computer Science, Superior University Lahore, Lahore, 54000, Pakistan; Alsubhi K., Department of Computer Science, King Abdulaziz University, Jeddah, Saudi Arabia; Aljahdali H.M., Faculty of Computing and Information Technology, King Abdulaziz University, Jeddah, Saudi Arabia"
"Bakar Siddique, Muhammad Abu (56539458800); Asad, Adeel (57216410459); Asif, Rao M. (57191492950); Rehman, Ateeq Ur (57210246601); Sadiq, Muhammad Tariq (57211516602); Ullah, Inam (57213242608)"	Implementation of Incremental Conductance MPPT Algorithm with Integral Regulator by Using Boost Converter in Grid-Connected PV Array	https://www.scopus.com/inward/record.uri?eid=2-s2.0-85106225663&doi=10.1080%2f03772063.2021.1920481&partnerID=40&md5=b7d46a29c0cb1f724c341e00ab763525	"College of New Energy, China University of Petroleum, Qingdao, China; College of Control Science and Engineering, China University of Petroleum, Qingdao, China; Faculty of Electrical Engineering, The Superior College, University Campus, Lahore, Pakistan; Department of Electrical Engineering, Government College University, Lahore, Pakistan; Department of Electrical Engineering, The University of Lahore, Lahore, Pakistan; College of Internet of Things Engineering, Hohai University, Changzhou, 213022, China"	"Bakar Siddique M.A., College of New Energy, China University of Petroleum, Qingdao, China; Asad A., College of Control Science and Engineering, China University of Petroleum, Qingdao, China; Asif R.M., Faculty of Electrical Engineering, The Superior College, University Campus, Lahore, Pakistan; Rehman A.U., Department of Electrical Engineering, Government College University, Lahore, Pakistan; Sadiq M.T., Department of Electrical Engineering, The University of Lahore, Lahore, Pakistan; Ullah I., College of Internet of Things Engineering, Hohai University, Changzhou, 213022, China"
"Iqbal, Muhammad Waseem (57194948912); Issa, Ghassan F. (44761234700); Yousif, Muhammad (58296487600); Atif, Muhammad (57193614938)"	Detection and Replay of Distributed Denial of Service Attacks in Smart Cities Using a Hybrid Deep Learning Approach	https://www.scopus.com/inward/record.uri?eid=2-s2.0-85160743736&doi=10.1109%2fICBATS57792.2023.10111332&partnerID=40&md5=5bc9520e9122aff66c021dd9bc4e4224	"Superior University, Department of Software Engineering, Lahore, Pakistan; Skyline University College, School of Information Technology, Sharjah, United Arab Emirates; Department of Computer Science, NCBAE, Lahore, Pakistan; Applied Science Research Center, Applied Science Private University, Amman, 11937, Jordan"	"Iqbal M.W., Superior University, Department of Software Engineering, Lahore, Pakistan; Issa G.F., Skyline University College, School of Information Technology, Sharjah, United Arab Emirates; Yousif M., Department of Computer Science, NCBAE, Lahore, Pakistan, Applied Science Research Center, Applied Science Private University, Amman, 11937, Jordan; Atif M., Department of Computer Science, NCBAE, Lahore, Pakistan"
"Zeshan Shabbir, Muhammad (58297015400); Naseer, Iftikhar (57220188741); Akhter, Shamim (58297450700); Abubakar, Muhammad (58254725000); Issa, Ghassan F. (44761234700); Hassaan Mehmood, Muhammad (58297232200)"	Fake Twitter Followers Detection using Machine Learning Approach	https://www.scopus.com/inward/record.uri?eid=2-s2.0-85160742647&doi=10.1109%2fICBATS57792.2023.10111260&partnerID=40&md5=14ba0a38f57359d6b8305c12e16b6460	"Comsats University, Faculty of Information and Technology, Islamabad, Pakistan; The Superior University, Faculty of Computer Science & Information Technology, Lahore, Pakistan; Minhaj University, School of Library & Information Sciences, Lahore, Pakistan; Fast School of Computing, National University of Computer and Emerging Sciences, Lahore, Pakistan; Skyline University College, School of Information Technology, University City Sharjah, Sharjah, 1797, United Arab Emirates; NCBA&E, School of Computer Science, Lahore, Pakistan; Applied Science Private Universit, Applied Science Research Center, Amman, 11937, Jordan"	"Zeshan Shabbir M., Comsats University, Faculty of Information and Technology, Islamabad, Pakistan; Naseer I., The Superior University, Faculty of Computer Science & Information Technology, Lahore, Pakistan; Akhter S., Minhaj University, School of Library & Information Sciences, Lahore, Pakistan; Abubakar M., Fast School of Computing, National University of Computer and Emerging Sciences, Lahore, Pakistan; Issa G.F., Skyline University College, School of Information Technology, University City Sharjah, Sharjah, 1797, United Arab Emirates; Hassaan Mehmood M., NCBA&E, School of Computer Science, Lahore, Pakistan, Applied Science Private Universit, Applied Science Research Center, Amman, 11937, Jordan"
"Yang, Jiawei (57367519700); Chen, Shuhong (36670848600); Wang, Guojun (57223145800); Wang, Zijia (57189054352); Jie, Zhiyong (57444596600); Arif, Muhammad (56452459100)"	GFL-ALDPA: a gradient compression federated learning framework based on adaptive local differential privacy budget allocation	https://www.scopus.com/inward/record.uri?eid=2-s2.0-85169576136&doi=10.1007%2fs11042-023-16543-y&partnerID=40&md5=3e5de76fe1e02dde113e2ecf7e0b6b18	"School of Computer Science and Cy-ber Engineering, Guangzhou University, Guangzhou, 510006, China; Department of Computer Science, Superior University, Lahore, 54000, Pakistan"	"Yang J., School of Computer Science and Cy-ber Engineering, Guangzhou University, Guangzhou, 510006, China; Chen S., School of Computer Science and Cy-ber Engineering, Guangzhou University, Guangzhou, 510006, China; Wang G., School of Computer Science and Cy-ber Engineering, Guangzhou University, Guangzhou, 510006, China; Wang Z., School of Computer Science and Cy-ber Engineering, Guangzhou University, Guangzhou, 510006, China; Jie Z., School of Computer Science and Cy-ber Engineering, Guangzhou University, Guangzhou, 510006, China; Arif M., Department of Computer Science, Superior University, Lahore, 54000, Pakistan"
"Hamid, Khalid (57702518800); Iqbal, Muhammad Waseem (57194948912); Aqeel, Muhammad (57518502000); Liu, Xiangyong (57023412400); Arif, Muhammad (56452459100)"	Analysis of Techniques for Detection and Removal of Zero-Day Attacks (ZDA)	https://www.scopus.com/inward/record.uri?eid=2-s2.0-85151056156&doi=10.1007%2f978-981-99-0272-9_17&partnerID=40&md5=77b95d80c0965f1e2e2a69d5ff58a3f7	"Department of Software Engineering, The Superior University, Lahore, 54000, Pakistan; Department of Computer Science, The Superior University, Lahore, 54000, Pakistan; School of Computer Science and Cyber Engineering, Guangzhou University, Guangzhou, 510006, China"	"Hamid K., Department of Software Engineering, The Superior University, Lahore, 54000, Pakistan; Iqbal M.W., Department of Software Engineering, The Superior University, Lahore, 54000, Pakistan; Aqeel M., Department of Computer Science, The Superior University, Lahore, 54000, Pakistan; Liu X., School of Computer Science and Cyber Engineering, Guangzhou University, Guangzhou, 510006, China; Arif M., Department of Computer Science, The Superior University, Lahore, 54000, Pakistan"
